{
  "$schema": "https://json-schema.org/draft/2020-12/schema",
  "$id": "https://example.org/schemas/bbom.schema.json",
  "title": "Behavioral Bill of Materials (BBOM)",
  "description": "Minimum machine-readable BBOM specification for high-impact AI workloads in G-SIFIs.",
  "type": "object",
  "additionalProperties": false,
  "required": [
    "artifact_id",
    "provider",
    "model_family",
    "training_cutoff",
    "intended_use",
    "prohibited_use",
    "autonomy_class",
    "tool_permissions",
    "max_authority_budget",
    "hazard_scores",
    "jurisdiction_constraints",
    "evaluation_suite_refs",
    "acceptance_thresholds",
    "runtime_detector_bindings",
    "signature"
  ],
  "properties": {
    "artifact_id": {
      "type": "string",
      "pattern": "^[a-zA-Z0-9._:-]{6,128}$"
    },
    "provider": {
      "type": "string",
      "minLength": 2,
      "maxLength": 128
    },
    "model_family": {
      "type": "string",
      "minLength": 2,
      "maxLength": 128
    },
    "training_cutoff": {
      "type": "string",
      "format": "date"
    },
    "intended_use": {
      "type": "array",
      "minItems": 1,
      "items": {
        "type": "string",
        "minLength": 3,
        "maxLength": 256
      }
    },
    "prohibited_use": {
      "type": "array",
      "minItems": 1,
      "items": {
        "type": "string",
        "minLength": 3,
        "maxLength": 256
      }
    },
    "autonomy_class": {
      "type": "string",
      "enum": [
        "advisory",
        "assistive",
        "delegated_bounded",
        "critical_autonomous"
      ]
    },
    "tool_permissions": {
      "type": "array",
      "items": {
        "type": "string",
        "minLength": 2,
        "maxLength": 128
      }
    },
    "max_authority_budget": {
      "type": "object",
      "additionalProperties": false,
      "required": ["tool_calls", "elapsed_seconds", "external_network"],
      "properties": {
        "tool_calls": {
          "type": "integer",
          "minimum": 0,
          "maximum": 100000
        },
        "elapsed_seconds": {
          "type": "integer",
          "minimum": 1,
          "maximum": 86400
        },
        "external_network": {
          "type": "boolean"
        },
        "max_write_ops": {
          "type": "integer",
          "minimum": 0,
          "maximum": 100000
        },
        "max_spend_usd": {
          "type": "number",
          "minimum": 0
        }
      }
    },
    "hazard_scores": {
      "type": "object",
      "additionalProperties": false,
      "required": ["deception", "jailbreak", "exfiltration"],
      "properties": {
        "deception": { "type": "number", "minimum": 0, "maximum": 1 },
        "jailbreak": { "type": "number", "minimum": 0, "maximum": 1 },
        "exfiltration": { "type": "number", "minimum": 0, "maximum": 1 },
        "goal_misgeneralization": { "type": "number", "minimum": 0, "maximum": 1 }
      }
    },
    "jurisdiction_constraints": {
      "type": "array",
      "minItems": 1,
      "items": {
        "type": "object",
        "additionalProperties": false,
        "required": ["jurisdiction", "rule"],
        "properties": {
          "jurisdiction": { "type": "string", "minLength": 2, "maxLength": 64 },
          "rule": { "type": "string", "minLength": 3, "maxLength": 512 }
        }
      }
    },
    "data_residency_constraints": {
      "type": "array",
      "items": {
        "type": "string",
        "minLength": 2,
        "maxLength": 128
      }
    },
    "evaluation_suite_refs": {
      "type": "array",
      "minItems": 1,
      "items": {
        "type": "string",
        "pattern": "^[a-zA-Z0-9._:/-]{3,256}$"
      }
    },
    "acceptance_thresholds": {
      "type": "object",
      "additionalProperties": false,
      "properties": {
        "max_deception": { "type": "number", "minimum": 0, "maximum": 1 },
        "max_exfiltration": { "type": "number", "minimum": 0, "maximum": 1 },
        "max_jailbreak": { "type": "number", "minimum": 0, "maximum": 1 }
      },
      "required": ["max_deception", "max_exfiltration"]
    },
    "runtime_detector_bindings": {
      "type": "array",
      "minItems": 1,
      "items": {
        "type": "object",
        "additionalProperties": false,
        "required": ["detector_id", "version", "severity_threshold"],
        "properties": {
          "detector_id": { "type": "string", "minLength": 2, "maxLength": 128 },
          "version": { "type": "string", "minLength": 1, "maxLength": 32 },
          "severity_threshold": { "type": "number", "minimum": 0, "maximum": 1 }
        }
      }
    },
    "expiry_conditions": {
      "type": "array",
      "items": {
        "type": "string",
        "minLength": 3,
        "maxLength": 256
      }
    },
    "signature": {
      "type": "object",
      "additionalProperties": false,
      "required": ["algorithm", "signed_by", "signed_at", "digest"],
      "properties": {
        "algorithm": { "type": "string", "minLength": 2, "maxLength": 64 },
        "signed_by": { "type": "string", "minLength": 2, "maxLength": 128 },
        "signed_at": { "type": "string", "format": "date-time" },
        "digest": { "type": "string", "minLength": 16, "maxLength": 256 }
      }
    }
  }
}
